<?xml version="1.0" encoding="utf-8"?>
<!DOCTYPE gui SYSTEM "layout.dtd">
<gui>
	<panel layout="border">
		<splitpane drawcontinuous="true" resizeweight="1" split="horizontal">
			<panel layout="border">
				<center>
					<panel layout="box" orientation="page">
						<component type="timerDisplay"/>
						<component type="scrambleArea"/>
					</panel>
				</center>
				<south>
					<panel layout="box" orientation="page">
						<scrollpane verticalpolicy="never" horizontalpolicy="asneeded">
							<panel alignmentY=".5" layout="flow" hgap="5" vgap="5">
								<component type="stackmatStatusLabel"/>
								<component type="scrambleChooser"/>
								<component type="scrambleNumber"/>
								<component type="scrambleAttributes"/>
								<component type="scrambleGenerator"/>
							</panel>
						</scrollpane>
						<panel layout="border">
							<center><panel><checkbox alignmentX=".5" action="keyboardTiming">i18n[usekeyboard]</checkbox></panel></center>
							<line_end>
								<panel>
									<button action="newSession">i18n[newsession]</button>
									<button action="reset">i18n[clearsession]</button>
								</panel>
							</line_end>
						</panel>
						<panel layout="box" orientation="line">
							<panel border="i18n[seshstats]" layout="grid" cols="1">
								<panel layout="box" orientation="line">
									<label>i18n[raof] stats[ra(0).size]</label>
									<button action="currentAverage0"><![CDATA[<html><font color="config[Statistics_Color_currentAverage]">i18n[currave] stats[ra(0, recent)] stats[ra(0).progress|parens]</font></html>]]></button>
									<button action="bestAverage0"><![CDATA[<html><font color="config[Statistics_Color_bestRA]">i18n[bestra] stats[ra(0, best)]</font></html>]]></button>
								</panel>
								<panel layout="box" orientation="line">
									<label>i18n[raof] stats[ra(1).size]</label>
									<button action="currentAverage1"><![CDATA[<html><font color="config[Statistics_Color_currentAverage]">i18n[currave] stats[ra(1, recent)] stats[ra(1).progress|parens]</font></html>]]></button>
									<button action="bestAverage1"><![CDATA[<html><font color="config[Statistics_Color_bestRA]">i18n[bestra] stats[ra(1, best)]</font></html>]]></button>
								</panel>
								<panel layout="box" orientation="line">
									<label>stats[session.solvecount(solved)]/stats[session.solvecount(attempt)] (i18n[solves]/i18n[attempts])</label>
									<button action="sessionAverage"><![CDATA[<html>i18n[seshave] stats[session.average] stats[session.average.progress|parens]</html>]]></button>
								</panel>
							</panel>
							<panel border="i18n[history]" layout="box" orientation="page">
								<panel><label alignmentX=".5">i18n[bestever] stats[global.time(best)]</label></panel>
								<panel><label alignmentX=".5">i18n[bestraof] stats[ra(0).size]: stats[global.ra(0, best)]</label></panel>
								<panel><label alignmentX=".5">stats[global.solvecount(solved)]/stats[global.solvecount(attempt)] i18n[globalaverage] stats[global.average]</label></panel>
							</panel>
						</panel>
					</panel>
				</south>
			</panel>
			<panel nominsize="false" layout="border">
				<tabbedpane>
					<component name="i18n[times] (stats[session.puzzleType])" type="timesList"/>
					<component name="i18n[sessions]" type="sessionsList"/>
				</tabbedpane>
			</panel>
		</splitpane>
	</panel>
	<menubar>
		<menu mnemonic="f">i18n[file]
			<menuitem action="importScrambles">i18n[import]</menuitem>
			<menuitem action="exportScrambles">i18n[export]</menuitem>
			<separator/>
			<menuitem action="addTime">i18n[addtime]</menuitem>
			<separator/>
			<menuitem action="showConfiguration">i18n[configuration]</menuitem>
			<separator/>
			<menuitem action="exit">i18n[exit]</menuitem>
		</menu>
		<menu mnemonic="o">i18n[options]
			<checkboxmenuitem action="toggleScramblePopup">i18n[togglescramblepopup]</checkboxmenuitem>
			<menu mnemonic="k">i18n[keyboardtimer]
				<checkboxmenuitem action="keyboardTiming">i18n[usekeyboard]</checkboxmenuitem>
				<checkboxmenuitem action="toggleStatusLight">i18n[statuslight]</checkboxmenuitem>
				<checkboxmenuitem action="toggleHideScrambles">i18n[hidescrambles]</checkboxmenuitem>
				<checkboxmenuitem action="toggleSpacebarStartsTimer">i18n[spacebaronly]</checkboxmenuitem>
				<checkboxmenuitem action="toggleFullscreenTiming">i18n[fullscreentiming]</checkboxmenuitem>
			</menu>
			<component type="customGUIMenu"/>
		</menu>
		<glue orientation="horizontal"/>
		<component type="languagecombobox"/>
		<component type="profilecombobox"/>
		<glue orientation="horizontal"/>
		<menu mnemonic="h">i18n[help]
			<menuitem action="showDocumentation">i18n[documentation]</menuitem>
			<menuitem action="showAbout">i18n[about]</menuitem>
		</menu>
		<button nominsize="true" action="togglefullscreen">+</button>
	</menubar>
</gui>
