<?xml version="1.0" encoding="utf-8"?>
<!DOCTYPE gui SYSTEM "layout.dtd">
<gui>
	<panel layout="border">
			<panel layout="border">
				<center>
					<panel layout="box" orientation="page">
						<component type="timerDisplay"/>
						<component type="scrambleArea"/>
					</panel>
				</center>
				<south>
					<panel layout="grid" cols="2">
					<panel><label>Cubes solved: stats[session.solvecount(solved)]</label></panel>
					<panel/>
					<panel><button action="sessionAverage">Session</button></panel>
					<panel><button action="currentAverage0">Current i18n[raof] stats[ra(0).size]</button><button action="bestAverage0">Best i18n[raof] stats[ra(0).size]</button></panel>
					</panel>
				</south>
			</panel>
	</panel>
	<menubar>
		<menu mnemonic="f">i18n[file1
			<menuitem action="importScrambles">i18n[import]</menuitem>
			<menuitem action="exportScrambles">i18n[export]</menuitem>
			<separator/>
			<menuitem action="addTime">i18n[addtime]</menuitem>
			<separator/>
			<menuitem action="showConfiguration">i18n[configuration]</menuitem>
			<separator/>
			<menuitem action="exit">i18n[exit]</menuitem>
		</menu>
		<menu mnemonic="o">i18n[options]
			<checkboxmenuitem action="toggleScramblePopup">i18n[togglescramblepopup]</checkboxmenuitem>
			<menu mnemonic="k">i18n[keyboardtimer]
				<checkboxmenuitem action="keyboardTiming">i18n[usekeyboard]</checkboxmenuitem>
				<checkboxmenuitem action="toggleStatusLight">i18n[statuslight]</checkboxmenuitem>
				<checkboxmenuitem action="toggleHideScrambles">i18n[hidescrambles]</checkboxmenuitem>
				<checkboxmenuitem action="toggleSpacebarStartsTimer">i18n[spacebaronly]</checkboxmenuitem>
				<checkboxmenuitem action="toggleFullscreenTiming">i18n[fullscreentiming]</checkboxmenuitem>
			</menu>
			<component type="customGUIMenu"/>
		</menu>
		<glue orientation="horizontal"/>
		<component type="scrambleChooser"/>
		<component type="profilecombobox"/>
		<glue orientation="horizontal"/>
		<button action="newSession">i18n[newsession]</button><button action="reset">i18n[clearsession]</button>
		<glue orientation="horizontal"/>
		<menu mnemonic="h">i18n[help]
			<menuitem action="showDocumentation">i18n[documentation]</menuitem>
			<menuitem action="showAbout">i18n[about]</menuitem>
		</menu>
		<button nominsize="true" action="togglefullscreen">+</button>
	</menubar>
</gui>
